{
  "schema": "xcodebuildmcp.output.coverage-result",
  "schemaVersion": "2",
  "didError": false,
  "error": null,
  "data": {
    "summary": {
      "status": "SUCCEEDED",
      "coveragePct": 83.1,
      "coveredLines": 157,
      "executableLines": 189
    },
    "coverageScope": "file",
    "artifacts": {
      "xcresultPath": "<TMPDIR>/TestResults.xcresult",
      "file": "CalculatorService.swift",
      "sourceFilePath": "<ROOT>/example_projects/iOS_Calculator/CalculatorAppPackage/Sources/CalculatorAppFeature/CalculatorService.swift"
    },
    "functions": {
      "notCovered": [
        {
          "line": 159,
          "name": "CalculatorService.deleteLastDigit()",
          "coveredLines": 0,
          "executableLines": 16
        },
        {
          "line": 58,
          "name": "implicit closure #2 in CalculatorService.inputNumber(_:)",
          "coveredLines": 0,
          "executableLines": 1
        },
        {
          "line": 98,
          "name": "implicit closure #3 in CalculatorService.calculate()",
          "coveredLines": 0,
          "executableLines": 1
        },
        {
          "line": 99,
          "name": "implicit closure #4 in CalculatorService.calculate()",
          "coveredLines": 0,
          "executableLines": 1
        },
        {
          "line": 162,
          "name": "implicit closure #1 in CalculatorService.deleteLastDigit()",
          "coveredLines": 0,
          "executableLines": 1
        },
        {
          "line": 172,
          "name": "implicit closure #2 in CalculatorService.deleteLastDigit()",
          "coveredLines": 0,
          "executableLines": 1
        },
        {
          "line": 214,
          "name": "implicit closure #4 in CalculatorService.formatNumber(_:)",
          "coveredLines": 0,
          "executableLines": 1
        }
      ],
      "partialCoverage": [
        {
          "line": 184,
          "name": "CalculatorService.updateExpressionDisplay()",
          "coveragePct": 80,
          "coveredLines": 8,
          "executableLines": 10
        },
        {
          "line": 195,
          "name": "CalculatorService.formatNumber(_:)",
          "coveragePct": 85.7,
          "coveredLines": 18,
          "executableLines": 21
        },
        {
          "line": 93,
          "name": "CalculatorService.calculate()",
          "coveragePct": 89.5,
          "coveredLines": 34,
          "executableLines": 38
        },
        {
          "line": 63,
          "name": "CalculatorService.inputDecimal()",
          "coveragePct": 92.9,
          "coveredLines": 13,
          "executableLines": 14
        }
      ],
      "fullCoverageCount": 28,
      "notCoveredFunctionCount": 7,
      "notCoveredLineCount": 22,
      "partialCoverageFunctionCount": 4
    }
  },
  "nextSteps": [
    "View overall coverage: get_coverage_report({ xcresultPath: \"<TMPDIR>/TestResults.xcresult\" })"
  ]
}
