{
  "schema": "xcodebuildmcp.output.coverage-result",
  "schemaVersion": "2",
  "didError": false,
  "error": null,
  "data": {
    "summary": {
      "status": "SUCCEEDED",
      "coveragePct": 94.9,
      "coveredLines": 371,
      "executableLines": 391
    },
    "coverageScope": "report",
    "artifacts": {
      "xcresultPath": "<TMPDIR>/TestResults.xcresult",
      "target": "CalculatorAppTests"
    },
    "targets": [
      {
        "name": "CalculatorAppTests.xctest",
        "coveragePct": 94.9,
        "coveredLines": 371,
        "executableLines": 391
      }
    ]
  },
  "nextSteps": [
    "View file-level coverage: xcodebuildmcp coverage get-file-coverage --xcresult-path <TMPDIR>/TestResults.xcresult"
  ]
}
